Painting ID,Title ,Artist ,Medium Description , Style,Wikipedia/WikiArt,Textbook/Museum,,,,,,,,
9,Jeanne (Spring),Edouard Manet,oil on canvas,Impressionism,"丼ouard Manet was a French painter. He was one of the first 19th-century artists to paint modern life, and a pivotal figure in the transition from Realism to Impressionism.

Born into an upper-class household with strong political connections, Manet rejected the future originally envisioned for him, and became engrossed in the world of painting. His early masterworks, The Luncheon on the Grass (Le d嶴euner sur l'herbe) and Olympia, both 1863, caused great controversy and served as rallying points for the young painters who would create Impressionism. Today, these are considered watershed paintings that mark the genesis of modern art. The last 20 years of Manet's life saw him form bonds with other great artists of the time, and develop his own style that would be heralded as innovative and serve as a major influence for future painters.

Manet's public career lasted from 1861, the year of his first participation in the Salon, until his death in 1883. His extant works, as catalogued in 1975 by Denis Rouart and Daniel Wildenstein, comprise 430 oil paintings, 89 pastels, and more than 400 works on paper.[27] The grave of Manet at Passy Although harshly condemned by critics who decried its lack of conventional finish, Manet's work had admirers from the beginning. One was ?mile Zola, who wrote in 1867: ""We are not accustomed to seeing such simple and direct translations of reality. Then, as I said, there is such a surprisingly elegant awkwardness ... it is a truly charming experience to contemplate this luminous and serious painting which interprets nature with a gentle brutality.""[28] The roughly painted style and photographic lighting in Manet's paintings was seen as specifically modern, and as a challenge to the Renaissance works he copied or used as source material. He rejected the technique he had learned in the studio of Thomas Couture 每 in which a painting was constructed using successive layers of paint on a dark-toned ground 每 in favor of a direct, alla prima method using opaque paint on a light ground. Novel at the time, this method made possible the completion of a painting in a single sitting. It was adopted by the Impressionists, and became the prevalent method of painting in oils for generations that followed.[29] Manet's work is considered ""rly modern"", partially because of the opaque flatness of his surfaces, the frequent sketchlike passages, and the black outlining of figures, all of which draw attention to the surface of the picture plane and the material quality of paint. The art historian Beatrice Farwell says Manet ""has been universally regarded as the Father of Modernism. With Courbet he was among the first to take serious risks with the public whose favour he sought, the first to make alla prima painting the standard technique for oil painting and one of the first to take liberties with Renaissance perspective and to offer ＆pure painting＊ as a source of aesthetic pleasure. He was a pioneer, again with Courbet, in the rejection of humanistic and historical subject-matter, and shared with Degas the establishment of modern urban life as acceptable material for high art."". ","Source 1: A chic young woman in a day dress with floral accents holds a parasol against a background of exuberant foliage. She looks straight ahead, a picture of poise and detachment even as she seems fully aware of the viewer's admiring gaze. Representing aspiring Parisian actress Jeanne Demarsy as the embodiment of Spring, this portrait debuted at the last major public exhibition of Manet's life, the Paris Salon of 1882. For more than two decades, Manet's paintings were rejected by the Salon or met with controversy; Spring was the most unalloyed success of the artist's Salon career, a career that ended tragically a year later when Manet died of causes related to syphilis. Appealing to critics primarily on account of Jeanne's charm, Spring also showcased Manet's mastery of his medium. The painting exhibits a marvelous range of brushwork, from the thin, delicate floral touches on the dress to the smooth handling of Jeanne's face and the broad, sketch-like strokes of the backdrop. The painting's sensual handling and bright, vibrant palette evoke the pleasures of the season it celebrates. When composing Spring, Manet had in view both the latest fashion trends and old artistic traditions. An avid connoisseur of feminine couture, he pieced together Jeanne's ensemble himself by scouring dressmakers' and milliners' shops. Posing his model in the studio, however, he referred to portrait conventions of the early Italian Renaissance, presenting her half-length, in profile, and against a mass of greenery. More than just an ephemeral ""fashion-plate,"" Manet's archetypal Spring was conceived as a picture for the ages, summarizing his modern epoch through the figure of a beautiful Parisienne.  

Souce 2: From the mid-1860s until his final year, Manet was the pioneer and leading exemplar of a revolutionary new style and its contemporary content. This portrait of the actress Jeanne Demarsy, cast as an allegory of spring, is the very climax of Manet＊s approach in his painting to femininity and fashion, consummately manifest in the artist＊s ground-breaking modern painterly style. Le Printemps, completed in 1881 and offered here, was one of two paintings the artist submitted to the Salon of 1882; the other was his supreme masterpiece, Un Bar aux Folies-Berg豕re, 1881-1882. This masterpiece comes completely fresh to the market, having remained in the same collection for over a century, and most recently, on loan for the last two decades to the National Gallery of Art in Washington, D.C.",,,,,,,,
10,The Anatomy Lecture of Dr. Nicolae Tulp,Rembrandt Harmenszoon van Rijn,oil on canvas,"Baroque, Northern Baroque, Dutch","The Anatomy Lesson of Dr. Nicolaes Tulp is a 1632 oil painting on canvas by Rembrandt housed in the Mauritshuis museum in The Hague, the Netherlands. Dr. Nicolaes Tulp is pictured explaining the musculature of the arm to medical professionals. Some of the spectators are various doctors who paid commissions to be included in the painting. The painting is signed in the top-left hand corner Rembrandt. f[ecit] 1632. This may be the first instance of Rembrandt signing a painting with his forename (in its original form) as opposed to the monogramme RHL (Rembrandt Harmenszoon of Leiden), and is thus a sign of his growing artistic confidence.
The event can be dated to 31 January 1632: the Amsterdam Guild of Surgeons, of which Tulp was official City Anatomist, permitted only one public dissection a year, and the body would have to be that of an executed criminal.[1] Anatomy lessons were a social event in the 17th century, taking place in lecture rooms that were actual theatres, with students, colleagues and the general public being permitted to attend on payment of an entrance fee. The spectators are appropriately dressed for this social occasion. It is thought that the uppermost (not holding the paper) and farthest left figures were added to the picture later.[2] Every five to ten years, the Surgeon's Guild would commission a portrait by a leading portraitist of the period; Rembrandt was commissioned for this task when he was 26 years old, and newly arrived in Amsterdam. It was his first major commission in Amsterdam. Each of the men included in the portrait would have paid a certain amount of money to be included in the work, and the more central figures (in this case, Dr. Tulp) probably paid more, even twice as much. Rembrandt's anatomical portrait radically altered the conventions of the genre, by including a full length corpse in the center of the image (using Christ-like iconography) and creating not just a portrait but a dramatic Mise-en-sc鋝e. Rembrandt's image is a fiction; in a typical anatomy lesson, the surgeon would begin by opening the chest cavity and thorax because the internal organs there decay most rapidly. One person is missing: the Preparator, whose task was to prepare the body for the lesson. In the 17th century an important scientist such as Dr. Tulp would not be involved in menial and bloody work like dissection, and such tasks would be left to others. It is for this reason that the picture shows no cutting instruments. Instead we see in the lower right corner an enormous open textbook on anatomy, possibly the 1543 De humani corporis fabrica (Fabric of the Human Body) by Andreas Vesalius.
The corpse is that of the criminal Aris Kindt (alias of Adriaan Adriaanszoon), who was convicted for armed robbery and sentenced to death by hanging. He was executed earlier on the same day of the scene.[3] The face of the corpse is partially shaded,[1] a suggestion of umbra mortis (shadow of death), a technique that Rembrandt was to use frequently. The French art historian Jean-Marie Clarke points out that the navel of the corpse has the shape of a capital R and connects this observation to the fact that Rembrandt worked intensively on his signatures in 1632, using three types consecutively before settling on the final, first name form in 1633.[4] Kindt was discussed in the 1999 novel The Rings of Saturn by W. G. Sebald, and plays a si""nificant role in Laird Hunt's 2006 novel The Exquisite. In her 2014 novel, ""The Anatomy Lesson"" author and journalist Nina Siegal tells the life story of Aris Kindt, based on documents about his criminal history that she discovered in the Amsterdam city archives. Medical specialists have commented on the accuracy of muscles and tendons painted by the 26-year-old Rembrandt. It is not known where he obtained such knowledge; it is possible that he copied the details from an anatomical textbook. However, in 2006 Dutch researchers recreated the scene with a male cadaver, revealing several discrepancies of the exposed left forearm compared to that of a real corpse.[5][6] The surgically astute will notice that the origin of the exposed forearm muscles would seem to indicate that the flexor compartment originates at the lateral epicondyle, when it is, in fact, the medial epicondyle. It is the common extensor origin that originates at the lateral epicondyle. In a 2007 study, the American artist and anatomist David J. Jackowe and his colleagues demonstrated that the mysterious white cord that courses along the ulnar aspect of the cadaver's carpus and little finger, long thought to be either an ulnar nerve variant or artistic error, is most likely the ","Khan Academy, Dr. Bryan Zygmont: 
Rembrandt was neither Italian nor a part of the Renaissance. Instead, Rembrandt was born in Leiden in 1606. This place and timeHolland during the height of the expansion of the wealthy mercantile class during the middle half of the seventeenth centuryserved Rembrandt well through his long career. The Catholic Church often commissioned Italian artists at this time to undertake large-scale projects to promote religious ideology in support of the Counter-Reformation. Without the Catholic Church in Holland to commission art, Rembrandt and his fellow Dutch artists were lavishly supported by a wealthy, Protestant, and expanding middle class. This group of patrons enthusiastically commissioned works of art with their increasing discretionary income. New subjects (including group portraits) Many different types of art became popular during the Dutch Baroque period. Genre paintingssmall paintings of everyday lifewere exceptionally popular with a middle-class clientele, as were still lifes, landscapes, and prints. The majority of these kinds of art were both affordable and small enough to be easily displayed within an average home. Larger and more compositionally complicated, group portraiture also became popular in Holland during the seventeenth century. This was a mode of painting that was often placed in a public space so that the image could promote a particular organization.
Relocating to Amsterdam Although several of Rembrandts most well-known paintings are group portraitsThe Anatomy Lesson of Dr. Tulp among othershis early education in Leiden, first at a Latin school and then later at the university, suggest that he was destined for a vocation other than art. However, by the time he was sixteen he decided he wanted to be a painter and a draughtsman. After finding quick success in Leiden during the 1620s, Rembrandt relocated to Amsterdam in 1631, a wise professional decision, as this was then one of the wealthiest and largest cities in Europe. 
A group portrait for the Amsterdam Surgeon's Guild Rembrandt van Rijn, The Anatomy Lesson of Dr. Tulp, 1632, oil on canvas, 169.5x 216.5 cm (Mauritshuis, The Hague) Rembrandt van Rijn, The Anatomy Lesson of Dr. Tulp, 1632, oil on canvas, 169.5 x 216.5 cm (Mauritshuis, The Hague) Just a year after his arrival, Rembrandt was offered the commission to complete a group portrait of the Amsterdam Surgeons Guild, an image that in time has come to be known rather simply as The Anatomy Lesson of Dr. Tulp. It is remarkable that Rembrandt received this commission as a newcomer to Amsterdam when there were other native-born artists available. Thomas de Keyser (above) and Nicolaes Pickenoy (below), for example, were older and more experienced in the realm of group portraiture. Whereas another artist may have simply recreated a previous group imageinserting new heads in place of old onesRembrandt created something new, and in doing so, completed one of the most recognizable images in the history of painting. Dr. Nicolaes Tulp was appointed praelector (like a professor or lecturer) of the Amsterdam Anatomy Guild in 1628. One of the responsibilities of this position was to deliver a yearly public lecture on some aspect of human anatomy. The lecture in 1632 occurred on 16 January, and this is the scene that Rembrandt depicts in paint in The Anatomy of Lesson of Dr. Tulp. This is a more complicated composition than it at first appears. Understandably, the focal point of the image is Dr. Tulp, the doctor who is shown displaying the flexors of the cadavers left arm. Rembrandt notes the doctors significance by showing him as the only person who wears a hat. Seven colleagues surround Dr. Tulp, and they look in a variety of directionssome gaze at the cadaver, some stare at the lecturer, and some peek directly at the viewer. Each face displays a facial expression that is deeply personal and psychological. The cadaver〞a recently executed thief named Adriaen Adriaenszoon〞lies nearly parallel t",,,,,,,,
11,L.H.O.O.Q.,Marcel Duchamp,"reproduction of Leonardo da Vinci's Mona Lisa with added mustache, goatee, and title","Dada, French","First conceived in 1919, the work is one of what Duchamp referred to as readymades, or more specifically an assisted ready-made. The readymade involves taking mundane, often utilitarian objects not generally considered to be art and transforming them, by adding to them, changing them, or (as in the case of his most famous work Fountain) simply renaming them and placing them in a gallery setting. In L.H.O.O.Q. the objet trouv谷 (""ound object"") is a cheap postcard reproduction of Leonardo da Vinci's Mona Lisa onto which Duchamp drew a moustache and beard in pencil and appended the title. Although many say it was pioneered by him, in 1887 Eug豕ne Bataille created a Mona Lisa smoking a pipe, published in Le Rire.[2] Eug豕ne Bataillee, La Joconde fumant la pipe, Le Rire, 1887 The name of the piece, L.H.O.O.Q., is a pun; the letters pronounced in French sound like ""le a chaud au cul"", ""She is hot in the arse"";[3] ""avoir chaud au cul"" is a vulgar expression implying that a woman has sexual restlessness. In a late interview (Schwarz 203), Duchamp gives a loose translation of L.H.O.O.Q. as ""there is fire down below"". As was the case with a number of his readymades, Duchamp made multiple versions of L.H.O.O.Q. of differing sizes and in different media throughout his career, one of which, an unmodified black and white reproduction of the Mona Lisa mounted on card, is called L.H.O.O.Q. Shaved. The masculinized female introduces the theme of gender reversal, which was popular with Duchamp, who adopted his own female pseudonym, Rrose S谷lavy, pronounced ""ros, c'est la vie"" (""Eros, that's life"").[4] Primary responses to L.H.O.O.Q. interpreted its meaning as being an attack on the iconic Mona Lisa and traditional art,[5] a stroke of 谷pater le bourgeois promoting the Dadaist ideals. According to one commentator: The creation of L.H.O.O.Q. profoundly transformed the perception of La Joconde (what the French call the painting, in contrast with the Americans and Germans, who call it the Mona Lisa). In 1919 the cult of Jocondisme was practically a secular religion of the French bourgeoisie and an important part of their self image as patrons of the arts. They regarded the painting with reverence, and Duchamp's salacious comment and defacement was a major stroke of epater le bourgeois (""reaking out"" or substantially offending the bourgeois).[6] According to Rhonda R. Shearer the apparent reproduction is in fact a copy partly modelled on Duchamp's own face. Parodies of Duchamp's parodic Mona Lisa. 

  rem","In 1919, Duchamp performed a seemingly adolescent prank using a postcard that represented the ideal of feminine beauty, Leonardo da Vinci's?Mona Lisa. He drew a mustache and goatee on her face and added the letters ""L.H.O.O.Q."" The caption combines Duchamp's gleeful sense of wit with his love of wordplay: eliding the letters in French sounds like, ""Elle a chaud au cul"" (""There is fire down below""). The image trespasses traditional boundaries of appropriation by presenting a reproduction, however tarted up, as an original work of art. The masculinized female introduces the theme of gender reversal, which was popular with Duchamp, who adopted his own female pseudonym, Rrose S谷lavy, pronouced ""ros, c'est la vie"" (""Eros, that's life"").?La Jocondeinstantly became his most famous readymade and a symbol for the international Dada movement, which rebelled against everything that art represented, particularly the appeal to tradition and beauty. The term ""rectified and readymade"" indicates that the artist has altered a found, mass-produced object..",,,,,,,,
