Painting ID,Title ,Artist ,Medium Description , Style,Wikipedia/WikiArt,Textbook/Museum,,,,,,,,
0,Michael Jackson and Bubbles,Jeff Koons,"porcelain, sculpture, painted","Pop art, kitsch","Michael Jackson and Bubbles is a porcelain sculpture (42 x 70.5 x 32.5 in) by the American artist Jeff Koons. It was created in 1988 within the framework of his Banality series. The life-size porcelain sculpture depicts the American singer-songwriter Michael Jackson leaning back on a flower bed. On his lap reclines his domesticated chimpanzee Bubbles who clasps a white cloth. Jackson and his pet form an optical unit. They wear similar clothing, are colored homogeneously and parts of their bodies are paralleled with each other, such as Jackson's right hand and Bubbles' paw. The sculpture has been arranged in a triangular and multi-perspective composition. Bubbles was Jackson's domestic animal who was bought by the artist from a Texas research facility in 1985. It has been claimed by the media that he was Jackson's best and faithful friend who even joined the singer on his world tours and helped in the household. Jeff Koons used a press photo of Jackson and Bubbles as a template for his sculpture. It is almost identical to the artist's work except for a slight variation of the posture. Koons changed Jackson's direction of view and thus adjusted the composition to the requirements of a sculptural work which has to take into account many different viewing angles.

At the time the sculpture was created, Jackson had already become a world-famous performer. Having achieved a sales record with his album Bad, he was at the pinnacle of his career. Koons artwork can be read as a comment on the great media interest that has been directed at Jackson's life as musician and as a private person. Three of the Michael Jackson and Bubbles sculpture were made. One was sold at Sotheby's on 15 May 2001, when it was auctioned off to the record price of 5.6 million dollars The artist's proof is owned by the Broad Art Foundation of businessman and art collector Eli Broad and is displayed in the Los Angeles County Museum of Art (It is now at The Broad Museum in Downtown Los Angeles). The two other versions are in Athens and in the San Francisco Museum of Modern Art. Jeff Koons has stated that his works of art should reach the largest possible audience. For this purpose he sought inspiration in entertainment media, pop culture and Christian art. The depiction of a media effective person like Michael Jackson might have helped him to achieve this aim.[3] In the 1980s, which were characterized by a new consumer and media culture, Jackson enjoyed an enormous chart success and became a pop icon. Koons now overemphasized the King of Pop's icon-like manner paralleling him with Christian icons. The artist once said about the sculpture: I wanted to create him in a very god-like icon manner. But I always liked the radicality of Michael Jackson; that he would do absolutely anything that was necessary to be able to communicate with people. 〞 Jeff Koons[3] Koons has stated that he was also inspired by the triangular composition of Michelangelo's Piet角.[5] Furthermore, the work's material reminds of catholic mass-produced figures of saints which are usually manufactured in porcelain and gold leaf. Thus the sculpture becomes a kitschy object that is appealing for a wide public and the art market.[6] Koons claims that he wanted to depict Jackson as a new redemptive figure who enables people to discover their own cultural mythology.[7] Michael Jackson and Bubbles has also been read as a symbol of the human desire for self-discovery.[8] Jackson demonstrated publicly his childlike personality and tried to reinvent himself by means of plastic surgery. Koons was fascinated by the self transformations of Jackson and the way he played with images such as himself against Bubbles.[3] The assimilated chimp on his lap underlines this aspect of self-exploration. He is a traditional symbol in fine arts which serves to mirror h","Over the past thirty-five years, Jeff Koons has become one of the most popular, influential, controversial, and important artists of the postwar generation. Throughout his career, he has pioneered new approaches to the readymade, tested the boundaries between advanced art and mass culture, and challenged the limits of industrial fabrication in works of great beauty and emotional intensity. Outside of his studio, Koons has transformed the relationship of artists to the cult of celebrity and the global market to become one of the best-known visual artists alive today. Jeff Koons: A Retrospective is the artists first large-scale museum presentation in New York and also the first time that a single artists work will fill nearly the entire Museum. Organized by Nancy and Steve Crown Family Curator and Associate Director of Programs Scott Rothkopf, the exhibition surveys more than three decades of Jeff Koonss art and includes approximately 140 works across a variety of mediums. On view from June 27 through October 19, 2014, this landmark exhibition is the Whitneys grand finale in its uptown Breuer building before the Museum opens its new building downtown in spring 2015. Jeff Koons: A Retrospective features a range of works from each stage of the artists career, representing the following series: Inflatables, Pre-New, The New, Equilibrium, Luxury & Degradation, Statuary, Banality, Made in Heaven, Easyfun, Celebration, Popeye, Hulk Elvis, Antiquity, and Gazing Ball. In addition, the Whitney is showing several new pieces by Koons, including the monumental Play-Doh, which the artist has been working on for more than twenty years. Rothkopf remarks: Its hard to think of another living artist who has pushed as many aesthetic and cultural limits as Koons has.  In his Banality series 1988 he produced sculptural pairings such as the pop singer Michael Jackson and his pet chimpanzee (in Michael Jackson and Bubbles 1988). This series also included art magazine ads, starring Koons himself, which played on his newfound art-world celebrity. The 1980s were a time of excess with the decade often referred to as the decade of greed. Koons works played on such decadence. Koons Banality sculpture series, released in 1988, presents a commentary on American society and its insatiable appetite for glamorous commodities. Fashioned out of porcelain, these large works of kitsch present familiar and innocuous pop and historical motifs in disturbing, occasionally sexualized, contexts. Banality. 

Imagine walking into an art gallery and seeing overgrown toys, or cartoon characters presented as sculpture.  If, in 1988, you had wandered into the Sonnabend Gallery on West Broadway in New York City, this is indeed what you would have witnessed: it was an exhibition entitled ※Banality§ by New York artist Jeff Koons presenting some twenty sculptures in porcelain and polychromed wood. The work certainly strikes as an affront to taste: the sculptures are highly polished and gleaming. The colors〞muted pale blue, pink, lavender, green and yellowish gold〞seem to belong to the 1950s and 60s. The glossy textures look garish and factory-made, surfaces one associates with inexpensive commercial art. One would almost want to call these sculptures ※figurines§ were it not for their size. To add to this catalogue of horrors, the artist had farmed out the actual production to German and Italian artisans who made each work in triplicate!  ※Banality§ thus debuted simultaneously in New York, Chicago, and Cologne.  

Jeff Koons, Pink Panther, 1988, glazed porcelain, 104.1 x 52 x 48.2 cm (The Museum of Modern Art) (photo: Jack Zalium, CC BY-N""glazed porcelain statue entitled Pink Panther belongs to that body of work. It depicts a smiling, bare-breasted, blond woman scantily clad in a mint-green dress, head tilted back and to the left as if addressing a crowd of onlookers. The figure is based on the 1960s B-list Hollywood star Jayne Mansfield〞here she clutches a limp pink panther in her left hand, while her right hand covers an exposed breast. From behind one sees that the pink panther has its head thrown over her shoulder and wears an expression of hapless weariness. It too is a product of Hollywood fantasy〞the movie of the same name debuted the cartoon character in 1963. The colors are almost antiquat"" do they harken back to the popular culture of a pre-civil rights era as a politically regressive statement of nostalgia? And what about the female figure〞posed in a state of deshabille (carelessly and partially undressed)?  At a time of increased feminist presence in the still male-dominated art world this could only be perceived as a rearguard move.  Or was Koons〞a postmodern provocateur like no other〞simply parodying male authority as he had done in some of his other work? 

Postmodernism: the artist as critic of mass culture

Provocation is a mainstay of the modernist avant-gardes reaching at least as back as far as when Marcel Duchamp＊s Fountain of 1917, an ordinary urinal, was proposed as an artwork  (""t-garde"" refers to artists whose work challenges established ideas).  But whereas Duchamp eventually accrued near-mythical status, that same critical reception for Koons was not forthcoming〞in fact, he would become one of the first artists of this period to achieve a level of success that depended more on the art market than on art criticism. He is still reviled. Only recently a review described Koons as ※Duchamp with lots of ostentatious trimmings.""] It's easy to see why he has continued to provoke: the postmodern 1980s inaugurated the contemporary sense of the artist as a critical and serious interrogator of mass culture and mass media. Cindy Sherman, Untitled Film Still #2, 1977, gelatin silver print, 24.1 x 19.2 cm (The Museum of Modern Art)

Cindy Sherman, one of the most prominent artists of that period, made photographs of herself that paraded the clich谷s of femininity before an audience that consumed critical theory about the constructed nature of reality and the oppressive manipulations of mass media. Her work was understood as a deconstruction (shorthand for the examination and analysis of the elements) of gender stereotypes. Another prominent postmodern artist of the period, Krzysztof Wodcizko, used high-powered projectors to cast politically charged imagery onto corporate fa?ades after dark〞imagery that often pointed to economic and social contradictions and prompted public discourse within an ephem",,,,,,,,
1,Soap Bubble Set,Joseph Cornell,"assemblage, collage","Surrealism, assemblage","Joseph Cornell (December 24, 1903 每 December 29, 1972) was an American artist and sculptor, one of the pioneers and most celebrated exponents of assemblage. Influenced by the Surrealists, he was also an avant-garde experimental filmmaker. Cornell's most characteristic art works were boxed as""mblages created from found objects. These are simple shadow boxes, usually fronted with a glass pane, in which he arranged eclectic fragments of photographs or Victorian bric a brac, in a way that combines the formal austerity of Constructivism with the lively fantasy of Surrealism. Many of his boxes, such as the famous Medici Slot Machine boxes, are interactive and are meant to be handled.[9] Like Kurt Schwitters, Cornell could create poetry from the commonplace. Unlike Schwitters, however, he was fascinated not by refuse, garbage, and the discarded, but by fragments of once beautiful and precious objects he found on his frequent trips to the bookshops and thrift stores of New York.[10] His boxes relied on the Surrealist use of irrational juxtaposition, and on the evocation of nostalgia, for their appeal. Cornell never regarded himself as a Surrealist; although he admired the work and technique of Surrealists like Max Ernst and Ren谷 Magritte, he disavowed the Surrealists' ""lack magic"", claiming that he only wished to make white magic with his art. Cornell's fame as the leading American ""Surrealist"" allowed him to befriend several members of the Surrealist movement when they settled in the United States during the Second World War. Later he was claimed as a herald of pop art and installation art. Cornell often made series of boxed assemblages that reflected his various interests: the Soap Bubble Sets, the Medici Slot Machine series, the Pink Palace series, the Hotel series, the Observatory series, and the Space Object Boxes, among others. Also captivated with birds, Cornell created an Aviary series of boxes, in which colorful images of various birds were mounted on wood, cut out, and set against harsh white backgrounds.[3] In addition to creating boxes and flat collages and making short art films, Cornell also kept a filing system of over 160 visual-documentary ""dossiers"" on themes that interested him; the dossiers served as repositories from which Cornell drew material and inspiration for boxes like his ""penny arcade"" portrait of Lauren Bacall. He had no formal training in art, although he was ext","Souce 1: This box was first shown in an exhibition William Copley organized at his Beverly Hills gallery in 1948, the entire contents of which he had bought from Cornell. The show was, in Copley＊s words, an ※enormous failure.§ Copley attributed this to the fact that his installation transformed the gallery into one large box. Plastering the walls and ceiling with the blue-and-white catalogues and scattering clay pipes among the boxes displayed on glass shelves, he created a whole artwork, which he felt inhibited the public from entering (see Bill Copley, ※Joseph Cornell,§ in New York, Castelli, Feigen, Corcoran,?Joseph Cornell Portfolio, 1976, exh. cat., n. pag.). Judging from the catalogue of the 1948 show, at least four Soap Bubble Sets were displayed. In the brief catalogue notes, Cornell wrote: ""w Box. Shadow boxes become poetic theatres or settings wherein are metamorphosed the elements of a childhood pastime. The fragile, shimmering globules become the shimmering but more enduring planets〞a connotation of moon and tides 每 the association of water less subtle, as when driftwood [sic] pieces make up a proscenium to set off the dazzling white of sea-foam and billowy cloud crystalized in a pipe of fancy.""and Re",,,,,,,,
2,Boy with a basket of fruit ,Michelangelo Merisi di Caravaggio,oil on canvas,"Baroque, ","The painting dates from the time when Caravaggio, newly arrived in Rome from his native Milan, was making his way in the competitive Roman art world. The model was his friend and companion, the Sicilian painter Mario Minniti, at about 16 years old. The work was in the collection of Giuseppe Cesari, the Cavaliere d'Arpino, seized by Cardinal Scipione Borghese in 1607, and may therefore date to the period when Caravaggio worked for d'Arpino ""painting flowers and fruits"" in his workshop; but it may date from a slightly later period when Caravaggio and Minniti had left Cavalier d'Arpino's workshop (January 1594) to make their own way selling paintings through the dealer Costantino. Certainly it cannot predate 1593, the year Minniti arrived in Rome. It is believed to predate more complex works from the same period (also featuring Minniti as a model) such as The Fortune Teller and the Cardsharps (both 1594), the latter of which brought Caravaggio to the attention of his first important patron, Cardinal Francesco Maria Del Monte. Vittorio Sgarbi notes certain Murillesque portraiture qualities in the painting that could easily point to other painters in the Arpino workshop.[1] At one level the painting is a genre piece designed to demonstrate the artist's ability to depict everything from the skin of the boy to the skin of a peach, from the folds of the robe to the weave of the basket. The fruit is especially exquisite, and Professor Jules Janick of the Department of Horticulture and Landscape Architecture at Purdue University, Indiana, has analysed them from a horticulturalist's perspective: The basket ... contains a great many fruits, all in nearly perfect condition and including a bi-colored peach with a bright red blush; four clusters of grapes 〞 two black, one red, and one ""hite;"" a ripe pomegranate split open, disgorging its red seeds; four figs, two of them dead-ripe, black ones, both split and two light-colored; two medlars; three apples〞two red, one blushed and the other striped, and one yellow with a russet basin and a scar; two branches with small pears, one of them with five yellow ones with a bright red cheek and the other, half-hidden, with small yellow, blushed fruits. There are also leaves showing various disorders: a prominent virescent grape leaf with fungal spots and another with a white insect egg mass resembling that of the oblique banded leaf roller (Choristoneura rosaceana), and peach leaves with various spots. The analysis indicates that Caravaggio is being realistic, in capturing only what was in the fruit basket; he idealizes neither their ripeness nor their arrangement〞yet almost miraculously, we are still drawn in to look at it; for the viewer it is very much a beautiful and exquisite subject. ","This early genre painting by Caravaggio (Fig. 3) is of a sensual young boy holding a huge basket filled with fruit. The model has been identified as Mario Minniti, who appears in many of the early works, and who became a painter in his own right. The basket, the main focus of the painting, contains a great many fruits, all in nearly perfect condition and including a bicolored peach with a bright red blush; four clusters of grapes〞two black, one red, and one ""hite;"" a ripe pomegranate split open, disgorging its red seeds; four figs, two of them dead-ripe, black ones, both split and two light-colored; two medlars; three applestwo red, one blushed and the other striped, and one yellow with a russet basin and a scar; two branches with small pears, one of them with five yellow ones with a bright red cheek and the other, half-hidden, with small yellow, blushed fruits. There are also leaves showing various disorders: a prominent virescent grape leaf with fungal spots and another with a white insect egg mass resembling that of the oblique banded leaf roller (Choristoneura rosaceana), and peach leaves with various spots. Incongruously, there are two sprigs with reddish foliage, perhaps mint. While the display of fruits is beautiful, it does not have the super-realism characteristic of some of the later paintings. 
However, John Spike has led me to a vast literature on the erotic imagery of fruit paintings by Renaissance artists (see Morel, 1985; Von Lates, 1995; Lecoq 2000). There seems no doubt that Caravaggio does indeed use subtly erotic double entendres in at least two paintings: Self Portrait as Bacchus (Von Lates, 1995) and Still Life with Fruit on a Stone Ledge, the latter based on similarities with Giovanni da Udine＊s obvious pornographic allusions found in the festoon in the loggia of Agostino Chigi at the Farn谷sina bordering Raphael's Cupid and Psyche (Vasari, 1550; Morel, 1985).

Spike (2002) assumes the stone ledge is an altar table. The profusion of fruits is described with both religious and erotic overtones:
...A profuse harvest of late summer fruits, squashes, and melons, fills its surface, dramatically illuminated from above. The allusion is again to Amos's likening of the imminent judgment to the end of the summer season. The fruits and cucurbits are for the most part disposed in pairs, one intact and the other split open. The spilling of seed〞of pomegranates, in particular〞are a Christian symbol of Resurrection. The wicker b",,,,,,,,
3,Broadway Boggie Woogie,Piet Mondrian,oil on canvas,"Neo-Plasticism, De Stijl, pure abstraction","Broadway Boogie Woogie is a painting by Piet Mondrian completed in 1943, shortly after he moved to New York in 1940. Compared to his earlier work, the canvas is divided into a much larger number of squares. Although he spent most of his career creating abstract work, this painting is inspired by clear real-world examples: the city grid of Manhattan, and the Broadway boogie woogie music to which Mondrian loved to dance.[1] The painting was bought by the Brazilian sculptor Maria Martins for the price of $800 at the Valentine Gallery in New York City, after Martins and Mondrian both exhibited there in 1943.[2] Martins later donated the painting to the Museum of Modern Art in New York City.[3]","(Source 1) Mondrian arrived in New York in 1940, one of the many European artists who moved to the United States to escape World War II. He fell in love with the city immediately. He also fell in love with boogie-woogie music, to which he was introduced on his first evening in New York, and he soon began, as he said, to put a little boogie-woogie into his paintings. Mondrian's aesthetic doctrine of Neo-Plasticism restricted the painter's means to the most basic kinds of line〞that is, to straight horizontals and verticals〞and to a similarly limited color range, the primary triad of red, yellow, and blue plus white, black, and the grays between. But Broadway B""ie Woogie omits black and breaks Mondrian's once uniform bars of color into multicolored segments. Bouncing against each other, these tiny, blinking blocks of color create a vital and pulsing rhythm, an optical vibration that jumps from intersection to intersection like the streets of New York. At the same time, the picture is carefully calibrated, its colors interspersed with gray and white blocks in an extraordinary balancing act. Mondrian's love of boogie-woogie must have come partly because he saw its goals as analogous to his own: ""destruction of melody which is the destruction of natural appearance; and construction through the continuous opposition of pure means〞dynamic rhythm.""    The pictorial language of geometric abstraction, based on the use of simple geometric forms placed in nonillusionistic space and combined into nonobjective compositions, evolved as the logical conclusion of the Cubist destruction and reformulation of the established conventions of form and space. Initiated by Pablo Picasso and Georges Braque in 19089, Cubism subverted the traditional depiction relying upon the imitation of forms of the surrounding visual world in the illusionisticpost-Renaissanceperspectival space. The High Analytic Cubist phase, which reached its peak in mid-1910, made available to artists the planarity of overlapping frontal surfaces held together by a linear grid. The next phaseSynthetic Cubism, 191214introduced the flatly painted synthesized shapes, abstract space, and constructional elements of the composition. These three aspects became the fundamental characteristics of abstract geometric art. The freedom of experimentation with different materials and spatial relationships between various compositional parts, which evolved from the Cubist practice of collage and papiers coll廥 (1912), also emphasized the flatness of the picture surfaceas the carrier of applied elementsas well as the physical reality of the explored forms and materials. Geometric abstraction, through the Cubist process of purifying art of the vestiges of visual reality, focused on the inherent two-dimensional features of painting.

(Source 2) This process of evolving a purely pictorial reality built of elemental geometric forms assu",,,,,,,,
