Painting ID,Title ,Artist ,Medium Description , Style,Wikipedia/WikiArt,Textbook/Museum,,,,,,,,
15,Dance,Henri Mattise,oil on canvas,"Impressionism, fauvism, color theory, light ","French artist, known for both his use of colour and his fluid and original draughtsmanship. He was a draughtsman, printmaker, and sculptor, but is known primarily as a painter.[1] Matisse is commonly regarded, along with Pablo Picasso and Marcel Duchamp, as one of the three artists who helped to define the revolutionary developments in the plastic arts throughout the opening decades of the twentieth century, responsible for significant developments in painting and sculpture.[2][3][4][5] Although he was initially labelled a Fauve (wild beast), by the 1920s he was increasingly hailed as an upholder of the classical tradition in French painting.[6] His mastery of the expressive language of colour and drawing, displayed in a body of work spanning over a half-century, won him recognition as a leading figure in modern art.[7] Fauvism as a style began around 1900 and continued beyond 1910. The movement as such lasted only a few years, 1904每1908, and had three exhibitions.[19][20] The leaders of the movement were Matisse and Andr谷 Derain.[19] Matisse's first solo exhibition was at Ambroise Vollard's gallery in 1904,[16] without much success. His fondness for bright and expressive colour became more pronounced after he spent the summer of 1904 painting in St. Tropez with the neo-Impressionists Signac and Henri-Edmond Cross.[15] In that year he painted the most important of his works in the neo-Impressionist style, Luxe, Calme et Volupt谷.[15] In 1905 he travelled southwards again to work with Andr谷 Derain at Collioure. His paintings of this period are characterised by flat shapes and controlled lines, using pointillism in""ss rigorous way than before. Matisse and a group of artists now known as ""Fauves"" exhibited together in a room at the Salon d'Automne in 1905. The paintings expressed emotion with wild, often dissonant colours, without regard for the subject's natural colours. Matisse showed Open Window and Woman with the Hat at the Salon. Critic Louis Vauxcelles described the work with the phrase ""Donatello parmi les fauves!"" (Donatello among the wild beasts), referring to a Renaissance-type sculpture that shared the room with them.[21] His comment was printed on 17 October 1905 in Gil Blas, a daily newspaper, and passed into popular usage.[19][21] The exhibition garnered harsh criticism〞"" pot of paint has been flung in the face of the public"", said the critic Camille Mauclair〞but also some favourable attention.[21] When the painting that was singled out for special condemnation, Matisse's Woman with a Hat, was bought by Gertrude and Leo Stein, the embattled artist's morale improved considerably.[21] Les toits de Collioure, 1905, oil on canvas, The Hermitage, St. Petersburg, Russia Matisse was recognised as a leader of the Fauves, along with Andr谷 Derain; the two were friendly rivals, each with his own followers. Other members were Georges Braque, Raoul Dufy, and Maurice de Vlaminck. The Symbolist painter Gustave Moreau (1826每1898) was the movement's inspirational teacher. As a professor at the ?cole des Beaux-Arts in Paris, he pushed his students to think outside of the lines of formality and to follow their visions. In 1907 Guillaume Apollinaire, commenting about Matisse in an article published in La Falange, wrote, ""are not here in the presence of an extravagant or an extremist undertaking: Matisse's art is eminently reasonable.""[22] But Matisse's work of the time also encountered vehement criticism, and it was difficult for him to provide for his family.[11] His painting Nu bleu (1907) was burned in effigy at the Armory Show in Chicago in 1913.[23] The decline of the Fauvist movement after 1906 did not affect the career of Matisse; many of his finest works were created between 1906 and 1917, when he was an active part of the great gathering of artistic talent in Montparnasse, even though he did not quite fit in, with his conservative appearance and strict bourgeois work habits. He continued to absorb new influences. He travelled to Algeria in 1906 studying African art and Primitivism. After viewing a large exhibition of Islamic art in Munich in 1910, he spent two months in Spain studying Moorish art. He visited Morocco in 1912 and again in 1913 and while painting in Tangiers he made several changes to his work, including his use of black as a colour.[24][25][26] The effect on Matisse's art was a new boldness in the use of intense, unmodulated colour, as in L'Atelier Rouge (1911).[15] He created one of his major works La Danse specially for Shchukin as part of a two painting commission, the other painting being Music, 1910. An earlier version of La Danse (1909) is in the collection of The Museum of Modern Art in New York City. 

Dance (La Danse) refers to either of two related paintings made by Henri Matisse between 1909 and 1910. The first, preliminary version is Matisse's study for the second version. The composition or arrangement of dancing figures is reminiscent of Blake's watercolour ""Oberon, Titania and Puck with fairies dancing"" from 1786.[1]

Dance (I)[edit] In March 1909, Matisse painted a preliminary version of this work, known as Dance (I).[2] It was a compositional study and uses paler colors and less detail.[3] The painting was highly regarded by the artist who once called it ""the overpowering climax of luminosity""; it is also featured in the background of Matisse's La Danse with Nasturtiums (1912). It was donated by Nelson A. Rockefeller in honor of Alfred H. Barr, Jr. to the Museum of Modern Art in New York. Dance[edit] Dance Matissedance.jpg Artist Henri Matisse Year 1910 Type Oil on canvas Dimensions 260 cm ℅ 391 cm (102.4 in ℅ 153.9 in) Location The Hermitage, St. Petersburg Dance, is a large decorative panel, painted wi""a companion piece, Music, specifically for the Russian businessman and art collector Sergei Shchukin, with whom Matisse had a long association. Until the October Revolution of 1917, this painting hung together with Music on the staircase of Shchukin's Moscow mansion.[4] The painting shows fi","MOMA: A monumental image of joy and energy, Dance is also strikingly daring. Matisse made the painting while preparing a decorative commission for the Moscow collector Sergei Shchukin, whose final version of the scene, Dance (II), was shown in Paris in 1910. Nearly identical in composition to this work, its simplifications of the human body were attacked as inept or willfully crude. Also noted was the work's radical visual flatness: the elimination of perspective and foreshortening that makes nearer and farther figures the same size, and the sky a plane of blue. This is true, as well, of the first version. Here, the figure at the left moves purposefully; the strength of her body is emphasized by the sweeping unbroken contour from her rear foot up to her breast. The other dancers seem so light they nearly float. The woman at the far right is barely sketched in, her foot dissolving in runny paint as she reels backward. The arm of the dancer to her left literally stretches as it reaches toward the leader's hand, where momentum has broken the circle. The dancers' speed is barely contained by the edges of the canvas. Dance (II) is more intense in color than this first version, and the dancers' bodies〞there deep red〞are more sinewy and energetic. In whatever canvas they appear, these are no ordinary dancers, but mythical creatures in a timeless landscape. Dance, Matisse once said, meant ""fe and rhythm.""

Khan Academy: In 1909 Matisse received an important commission. An extremely wealthy Russian industrialist named Sergei Shchukin asked Matisse for three large scale canvases to decorate the spiral staircase of his mansion, the Trubetskoy Palace, in Moscow. The large and well loved painting, Dance I at MoMA, is somewhat disingenously titled. Although it is full scale and in oil, Matisse did not consider it more than a preparatory sketch. Yet a comparison between the initial and final versions is instructive. Matisse borrowed the motif from the back of the 1905-06 painting Bonheur de Vivre, although he has removed one dancer. In Dance I, the figures express the light pleasure and joy that was so much a part of the earlier Fauve masterpiece. The figures are drawn loosely, with almost no interior definition. They have been likened to bean bag dolls because of their formless and unrestricted movements. The bodies certainly dont seem to be restrained by way. But dont let this childlike spontaneity fool you. Matisse works very hard to make his paintings seem effortless. Imagine for a moment, that instead of this childlike style, Matisse had decided to render this figures with the frozen density of Jacques Louis David. Would the sense of pure joy, the sense of play have been as well expressed? Matisse has done something that is actually very difficult. He has unlearned the lessons of representation so that he can create an image where form matches content. The dancers inhabit a brilliant blue and green field. But what exactly does the green represent? Many people would quickly reply, a grassy hilltop. Okay, but what then is the blue intended to represent? If I were lecturing at MoMA, as I often do, many listeners would offer that the blue is the sky that rises above the hill. But others in my group might begin to look frustrated. One might then say, thats not what I see, the blue is really water moving back into the distance. Henri Matisse, detail Dance I, 1909, oil on canvas, 259.7 x 390 cm (Museum of Modern Art, New York City) What Matisse has done here, even in seemingly simple rendering, is use spatial ambiguity to explore one of the key issues in modern painting, the conflict between the illusion of depth and an acknowledgment of the flatness of the canvas. One final point here, did you notice the break in the circle? The hands of the two front dancers are parted. Matisse has been careful to allow this break only where it overlaps the knee so as not to interrupt the continuity of the color. Why do this? The part is often interpreted in two ways, as a source of tension that requires resolution or, as an invitation to us the viewer to join in, after all, the break is at the point closest to our position. Henri Matisse, Dance, 1910, oil on canvas, 260 x 291 cm (The Hermitage, St. Petersburg) The final version of Dance has a very different emotional character. It has been described as forbidding, menacing, tribal, ritualistic, even demonic. Drum beats almost seem to be heard as the simple pleasure of the original is overwhelmed. What causes these dramatic changes in mood? Beyond the color shift, which is pretty obvious, the figures of the 1910 canvas are drawn with more interior line, line which often suggests tension and physical power. See for instance, the back left figure. Another more subtle change occurs where the two back figures touch the ground. In the 1909 canvas, the green reaches up to the feet of the two back most dancers, in the 1910 canvas, something else happens, the green seems to compress under the dancer＊s weight. This subtle change creates either a sense of lightness or a sense of weight and contributes to the way we perceive each painting. So be careful before concludi",,,,,,,,
16,Portrait of Bindo Altoviti,Raphaello Sanzio da Urbino,oil on canvas,"High Renaissance, Italian, Italian Renaissance ","The Portrait of Bindo Altoviti is a painting finished around 1515 by the Italian High Renaissance painter Raphael. It is housed in the National Gallery of Art of Washington, D.C., United States. Bindo Altoviti was a rich banker born in Rome in 1491, but of Florentine origin. He was a cultured man who liked the arts. The graceful, almost effeminate position of the subject along with the heavy contrast between light and shadow are atypical of Raphael's work, particularly of his portraits of men, demonstrating the artist's experimentation with different styles and forms in his later Roman period. The influence of the works of Leonardo, which Raphael studied astutely during this period of his career, is strikingly evident in this particular piece. The painting was a property of Altoviti＊s descendants until 1808, when it was sold to Ludwig I of Bavaria. It remained at the Alte Pinakothek until 1936, when, after many debates about its attribution, the painting was lured out of Nazi Germany by ""anny English dealers"".[1] Acquired by Samuel Henry Kress, the portrait subsequently became property of the National Gallery of Art in Washington, D.C.. A bronze bust of Altoviti by Benvenuto Cellini is exhibited in Boston at the Isabella Stewart Gardner Museum.[2]]","This arresting image was thought in the nineteenth century to be a Raphael self-portrait. However, we know today that this handsome young man was Bindo Altoviti, a wealthy Florentine banker and friend of the artist in Rome. He turns in a dramatic, almost theatrical, way to fix the eye of the viewer. Perhaps one viewer in particular was meant to receive his captivating look: Bindo's wife Fiammetta Soderini. Renaissance poets and courtiers were unanimous in believing that a person first fell in love through the eyes. They were called the ""guides of love,"" which could ""reveal the passion within more effectively than the tongue itself, or letter, or messengers."" Bindo's flushed cheeks contribute to the impression of passion, and a ring is prominent on the hand he holds above his heart. The robe slipping from his shoulder reveals a bare nape caressed by soft curls. Their golden color would have underscored the nobility and purity of his love. Bindo and Fiammetta, daughter of a prominent Florentine family, were married in 1511, when Bindo would have been about twenty. The couple had six children, but Fiammetta continued to live in Florence while Bindo's business with the papal court required his presence in Rome. This portrait, which apparently hung in the couple's home in Florence, would have provided Fiammetta with a vivid reminder of her absent husband. It remained in the Altoviti family for nearly three hundred years.",,,,,,,,
17,The Harlequin's Carnival,Joan Mir車,oil on canvas,Surrealism,"The Harlequin's Carnival (Spanish: Carnaval d'Arlequin) is an oil painting rendered by Joan Mir between 1924 and 1925. It is one of the most outstanding surrealist paintings of the artist, and it is preserved in the AlbrightKnox Art Gallery, Buffalo.[1] Created between 1924 and 1925, Harlequins Carnival is one of Joan Mirs best-known pieces. Harlequin is the name of a well-known Italian comic theater character that is generally identified by his checkered costume. The carnival in the title of the painting may refer to Mardi Gras, the celebration that occurs before the fasting of Lent begins. In 1924 poet Andr Breton formed the Surrealist movement. Around the time of the groups formation Mir started to paint in the surrealist style. Surrealism focused on dreams and the subconscious as artistic material, and Mir was able to draw from these ideas. He painted the subconscious, but also his own life experiences and memories. To combine these two sources he draws on his imagination to create magical elements in his paintings. This can even be seen in his early work, for instance in his 1922 detailist painting The Farm. This specific painting is centered on a harlequin at a carnival. Although the harlequin resembles a guitar, he still retains some of his harlequin characteristics such as a checkered costume, a mustache, an admiral＊s hat, and a pipe. The harlequin in this painting is sad, which could be due to the hole in his stomach. This detail may refer to Mir車＊s personal life experiences, because at this point in his life he did not have much money for food and was on the brink of starvation. This is a painting of a celebration; all the characters seem to be happy due to the fact they are playing, singing, and dancing. Some of the objects in the painting are anthropomorphized, and some seem to be moving and dancing as well. One example is the ladder to the left of the painting, which has an ear and an eye (Albright-Knox Art Gallery). According to Mir車, the ladder is a symbol of flight, evasion, and elevation. The green sphere to the right of the painting represents the globe because Mir車, according to him, was obsessed with the idea of ※conquering the world§ (Albright-Knox Art Galler","Carnival of Harlequin is one of Joan Mir車's best-known works. Harlequin was a common theater character who was usually the victim of unrequited love and frequently played the guitar. In this painting he is a guitar, with the diamond-patterned shirt associated with the character, along with other traditional features like the mustache, beard, admiral's hat, and pipe. He looks sad, perhaps because of the hole in his stomach, and Mir車 did have financial constraints at the time〞he remembered sharing radishes for dinner with a friend because it was all he had. It is thought that the title of the Gallery's painting refers to Mardi Gras, the celebration that begins the fasting of Lent. Other than Harlequin, it seems very joyous, with all kinds of hybrid creatures playing, singing, dancing, and celebrating. Some of the forms are anthropomorphized objects〞for example, the ladder has an ear and an eye. Mir車 explained some of the imagery in 1978: ""e canvas certain elements appear that will be repeated later in other works: the ladder, an element of flight and evasion, but also of elevation; animals, and above all, insects, which I have always found very interesting; the dark sphere that appears to the right is a representation of the globe, because in those days I was obsessed with one idea: 'I must conquer the world!;' the cat, who was always by my side as I painted. The black triangle that appears in the window represents the Eiffel Tower. I tried to deepen the magical side of things."""" exp",,,,,,,,
