Painting ID,Title ,Artist ,Medium Description , Style,Wikipedia/WikiArt,Textbook/Museum,,,,,,,,
14,"Chinati Foundation, Marfa, Texas",Donald Judd,"Concrete, sculpture",Minimalism,"The Chinati Foundation/La Fundaci鏮 Chinati is a contemporary art museum based upon the ideas of its founder, Donald Judd. The specific intention of Chinati is to preserve and present to the public permanent large-scale installations by a limited number of artists. The emphasis is on works in which art and the surrounding landscape are inextricably linked. As Judd wrote in the foundation's catalogue: It takes a great deal of time and thought to install work carefully. This should not always be thrown away. Most art is fragile and some should be placed and never moved again. Somewhere a portion of contemporary art has to exist as an example of what the art and its context were meant to be. Somewhere, just as the platinum-iridium meter guarantees the tape measure, a strict measure must exist for the art of this time and place. The Chinati Foundation is located on 340 acres of land on the site of former Fort D.A. Russell in Marfa, Texas. Construction and installation at the site began in 1979 with initial assistance from the Dia Art Foundation in New York. The Chinati Foundation opened to the public in 1986 as an independent, non-profit, publicly funded institution. Chinati was originally conceived to exhibit the work of Donald Judd, John Chamberlain and Dan Flavin. The collection was expanded and now includes 15 outdoor concrete works by Donald Judd, 100 aluminum works by Judd housed in two converted artillery sheds, 25 sculptures by John Chamberlain, an installation by Dan Flavin occupying six former army barracks, and works by Carl Andre, Ing車lfur Arnarsson, Roni Horn, Ilya Kabakov, Richard Long, Claes Oldenburg and Coosje van Bruggen, David Rabinowitch, and John Wesley. Each artist's work is installed in a separate building on the museum's grounds. Temporary exhibitions feature modern and contemporary art of diverse media. The Chinati Foundation sponsors art and education programs, establishing close links to the local community and other cultural institutions and universities in the United States and abroad. Started by Judd, Chinati's Artists in Residence Program provides artists from around the world an opportunity to devel"" and exhibit their work in a stimulating environment. Chinati's Internship Program offers students from a variety of disciplines hands-on museum experience. Each summer the museum hosts art classes for local students. Chinati produces an annual newsletter in English and Spanish, and every October, Chinati hosts a festive annual weekend focused on the museum's collection and programs.

The art and architecture of the past that we know is that which remains. The best is that which remains where it was painted, placed or built. Most of the art of the past that could be moved was taken by conquerors. Almost all recent art is conquered as soon as it's made, since it's first shown for sale and once sold is exhibited as foreign in the alien museums. The public has no idea of art other than that it is something portable that can be bought. There is no constructive effort; there is no cooperative effort. This situation is primitive in relation to a few earlier and better times.

Art and architecture - all the arts - do not have to exist in isolation, as they do now. This fault is very much a key to the present society. Architecture is nearly gone, but it, art, all of the arts, in fact all parts of the society, have to be rejoined, and joined more than they have ever been. This would be democratic in a good sense, unlike the present increasing fragmentation into separate but equal categories, equal within the arts, but inferior to the powerful bureaucracies.

Jose Ortega Y Gasset wrote: ""Pero 10 mas grave en esa aberracion intelectualista que significa la beateria de la cultura no es eso, sino que consiste en presentar al hombre la cultura, el ensimismamiento, el pensamiento, como una gracia 0 joya que este debe anadir a su vida, por tanto, como algo que se halla por 10 pronto fuera de ella, como si existiese un vivir sin cultura y sin pensar, como si fuese posible vivir sin ensimismarse. Con 10 cual se colocaba a los hombres - como ante el escaparate de una joyeria - en la opcion de adquirir la cultura 0 prescindir de ella. Y, claro esta, ante parejo dilema, a 10 largo de estos anos que estamos vivien do, los hombres no han vacilado, sino que han resuelto ensayar a fondo esto ultimo e intentan rehuir toto ensimismamiento y entregarse a la plena alteracion. ""
""But the most dangerous aspect of the intellectual aberration that this 'bigotry of culture' signifies is not this; it consists in presenting culture, withdrawal into one's self, thought, as a grace or jewel that man is to add to his life, hence as something that provisionally lies outside of his life and as if there were life without culture and thought - as if it were possible to live without withdrawing into one's self. Men were set, as it were, before a jeweler's window - were given the choice of acquiring culture or doing without it. And it is clear that, faced with such a dilemma, during the years we are now living through men have not hesitated, but have resolved to explore the second alternative to its limits and are seeking to flee from all abstraction and to give themselves up to the full alteration.""

Judd started using unpainted plywood in the early 1970s,[16] a material the artist embraced for its durable structural qualities, which enabled him to expand the size of his works while avoiding the problem of bending or buckling. Plywood had been the staple of his art earlier, but never unpainted.[17] He later began using Cor-ten steel in the 1980s for a small number of large-scale outdoor pieces, and by 1989 would create single and multi-part works with the material. The Cor-ten works are unique in that they are the only works the artist fabricated in Marfa. The artist began working with enamel on aluminum in 1984, when he commissioned Lehni AG in Switzerland to construct works by bending and riveting thin sheets of the material, a process Judd previously used to create furniture. These pieces were initially created for a temporary outdoor exhibition in Merian Park outside Basel.[citation needed] Judd would continue to produce pieces using these techniques through the early 1990s. Judd＊s work with enamel on aluminum greatly expanded his palette of colors, which had previously been restricted to the colors of anodized metal and Plexiglas, and led to the use of more than two colors in an individual artwork. Combining a wide range of colors, he used the material to create five large-scale floor pieces and many horizontal wall works in unique variations of color and size.[18][19] Judd＊s only known work in granite, an untitled Sierra White granite floor piece from 1978, m""ures 49 x 98 x 98"". The structure is composed of two vertical slabs that rest on the floor, to which the bottom component is c","The fifteen concrete works by Donald Judd that run along the border of Chinati's property were the first works to be installed at the museum and were cast and assembled on the site over a four-year period, from 1980 through 1984. The individual units that comprise each work have the same measurements of 2.5 x 2.5 x 5 meters, and are made from concrete slabs that are each 25 centimeters thick. Funding for the project was provided by the Dia Art Foundation.

In the late 1970s, when Donald Judd started work on his most ambi?tious project, which he later named the Chinati Foundation, he was not only rethinking the concept of the museum as such, he was also em?barking on his two most ambitious works of art, which were to be the culmination of his artistic career. The Chinati Foundation project was be?gun by Judd in 1978-79 in Marfa, Texas, where he had lived for the past five years and where he had al?ready turned two former aircraft hangars and the land around them into his own private residence. This property is a complete microcosm in its own right, whichlike a monastery has all of lifes essentials, from an excellent library to a chicken coop. Unusually, however, it also has an outstanding art collectionpredomi要antly works by Judd himselfgen苟rously laid out and interspersed in among everyday objects such as dining table, bed, armchair, music system. Judd was exploring the con要ection between art and life: art be苞ame the heart of the household and each piece was placed with as much care as he would expect from a museum display. The fact is that the Mansana de Chinatito give it its Hispanic nameis a mansion aspir虹ng to the status of a museum. Judd was well aware of this, and made all the relevant decisions with an eye to the future. While he was still alive, his creation functioned as a private home; now it works as a do衫estic museum, where the public can view an impressive collection of early pieces by Judd. Muchalthough not allof the Mansana was already finished when the possibility arose, through the Dia Art Foundation, of creating a new kind of museum in Marfa, a museum which would be able to ac苞ommodate large-scale works made specifically for it. This was the an貞wer to Judds long-cherished dream of creating something that exceeded the potential of conventional exhibi負ion practices and demanded more of the artist than a single work. Judd had been waiting for just such a challenge and the Dia Art Founda負ion was prepared to provide the finances needed to realize some負hing truly great. Both Dia and Judd shared ideals that were rooted in the Renaissance, ideals that they were not afraid to measure themselves against, be it on a philanthropic or an artistic level.

For Judd it was important that his art should relate to the architecture of the museum so that eachart and architecturewould both hold its own and underpin the other. He had so often been dissatisfied with the exhibition spaces in art museums, regarding them as largely unsuited to showing contemporary art. How苟ver, his aim in Marfa was more than simply to create suitable spaceshis ultimate aim was to unite art, architecture, and nature in an embodiment of his own philo貞ophical outlook, which sought to avoid fragmentation and to promote coherence. These had been the pa訃ameters for the Chinati project as a whole,1 which was to include instal衍ations by Dan Flavin and John Chamberlain as well as work by Judd himself. Its important to re衫ember that the aim was not to cre苔te a single-artist museum, but that the intention was that works by dif苯erent artists should enter into dia衍ogue with each other. Initially Judd wanted to restrict the work to these three artists alone, since he felt that it was already hard enough to cre苔te the right conditions for installa負ions by even just three artists and to take care of their work appropriate衍y in the long term. However, he was always interested in including work by additional artists in the collec負ion, and did so later on. After the break with the Dia Art Foundation in 1987, the collection was expanded to include work by Claes Oldenburg and Coosje van Bruggen, Ilya Kabakov, Carl Andre, Ingolfur Arnarsson, Roni Horn, Richard Long, and John Wesley. In this text, however, I will concen負rate entirely on the work of Donald Judd, specifically the two ensembles that he conceived for the Chinati Foundation. The first of these is the series of 15 multi-part works, made from concrete and placed outside in an open field (ill.3); the second is the group of 100 aluminum boxes which now occupy two large spaces, formerly gunsheds (ill. 17, p. 55). The sheer size of these en貞embles means that each was a huge undertaking in terms of its con苞eption, realization, and financial backing, and each took between four and six years to complete. Judd had never made anything even re衫otely as large and these projects posed unusual challenges in terms of their design and production. Al負hough they are similar in sizeone group consists of 60 units, the other has 100 units, and took much the same length of time to produce, hav虹ng been started at the same time they underwent very different pro苓uction processes, which I will presently describe. They cast an in負eresting light on Judds working methods in circumstances that were a mixture of challenging and not far short of ideal. The design for the 15 concrete pieces evolved in stages. Judd put his ideas down on paper in 84 drawings, with the result that we are now in the position to follow his thinking stage by stage and to un苓erstand the relevant chronology since all but a few of the drawings are dated. When the first contract was agreed with the Dia Art Founda負ion in spring 1979, there was still talk of certain large-scale outdoor sculptures, whose nature and ma負erials were yet to be determined by the artist. Adobe and concrete were aired as possibilities. In addi負ion, the agreement also states that the location for these works was yet to be identified and that it was as貞umed that one work would be real虹zed per year, with the contract to run for five years. Clearly much was still to be decided. Judds first handwritten note regard虹ng this project is dated August 1980 (ill. 1), in other words, roughly one year after the contract had first been agreed. However, in the mean負ime Judd had identified the location that the works were to be made for. He described it in this note as about 100 feet off Northsouth road at North; this is a reference to a dirt track that runs along the outer edge of the Chinati property. The chosen site runs parallel to this track, and was the only flat land in this otherwise slightly sloping site. The note states that the sculptures are to be placed in a straight line, as far as possible exactly on the north-south line of longitude, with every work centered precisely on this axis and equidistant from its neighbors. In the case of the works with a triangular configuration, one side was to coincide precisely with the east-west axis. An additional note (ill. 2) records the length of the site as 3,210 feet or 978 meters, of which 197 feet (60 meters) is taken up by an embankment, which leaves 3,094 feet or 942 meters that can be used. Divided by 15clearly the decision had been made that this should be the number of worksthis allows a distance of 63 meters be負ween the works, which Judd round苟d down to 60. So it had now been decided that there should be a dis負ance of 60 meters from the center of one to the center of the next of the 15 concrete works, regardless of their individual dimensions or the number of parts they consisted of; furthermore it had been decided that they should be placed north-south and east-west where necessary. Having determined these coordi要ates, Judd now had an underlying order which allowed him consider苔ble freedom in the design of the in苓ividual pieces. On the first sheet of sketches and notes, made in August 1980, there are already several indications of triangular structures. Three rectangu衍ar volumes form a triangle; the tips of the trianglewhich make up the basic shapeextend beyond the rectangles. The question of the dis負ances between the elements has not been fixed yeteither 2.5 or 2 me負ersbut it already seems to have been decided that the rectangles are positioned outside the triangle, with one long edge lying along the side of the triangle. Halfway down the note, on one side, there are two small rectangles side-by-side, with the words first and then fol衍owed by a triangle. This line has been scored through and replaced with a note that the first element should be a triangle. The third sheet (ill. 4) shows the same two configu訃ations again, although with the two- part figure on the left and the trian茆le on the right, as they were later realized. The distances between the elements are noted as 1.25 and 2.5 meters, as in the finished work. The distance from center to center is marked here as 200 feet or 70 me負ers, but there is also a number 603 under the 70, even if it is upside- down. The elements themselves are marked as 5 meters long and 2.5 meters deep. These measurements seem to have been decided very early on, for there is only one isolat苟d drawing with different measure衫ents, and this is clearly not rele赳ant to Judds thinking as a whole. It is interesting that Judd chose to work here with the metric systemeven though he measured his concurrent aluminum pieces in inches. The late 1970s and early 80s was a transi負ional phase for the artist; although he was using both systems of mea?surement at this time, he was veer?ing toward the metrical system, which is broadly speaking a simpler system that makes it easier to calcu?late relationships. With just a few exceptions〞such as the so-called stacks and progressions, which are based on measurements established in the 1960s〞from the early 1980s onwards Judd calculated his works, particularly any new pieces, in me?ters and centimeters. The concrete works at the Chinati Foundation are the first pieces of this size to b",,,,,,,,
